<?xml version="1.0" encoding="UTF-8"?>
<!DOCTYPE m:messages>
<?xml-stylesheet type="text/xml" href="messages.xsl"?>
<m:messages xmlns:m="http://www.docfaust.de/vbb"
	                xmlns:xsi="http://www.w3.org/2001/XMLSchema-instance"
	                xsi:schemaLocation="http://www.docfaust.de/vbb 
	                                    messages.xsd">
	<m:message>
		<m:code>NO_SEASON_CHOSEN</m:code>
		<m:severity>ERROR</m:severity>
		<m:summary>Keine Auswahl!</m:summary>
		<m:detail>Es wurde keine Saison ausgewählt</m:detail>
	</m:message>
	<m:message>
		<m:code>SEASON_DELETED</m:code>
		<m:severity>INFO</m:severity>
		<m:summary>Löschen erfolgreich</m:summary>
		<m:detail>Die Saison wurde gelöscht</m:detail>
	</m:message>
	<m:message>
		<m:code>SEASON_DELETION_ERROR</m:code>
		<m:severity>ERROR</m:severity>
		<m:summary>Löschen fehlerhaft!</m:summary>
		<m:detail>Die Saison wurde nicht gelöscht.</m:detail>
	</m:message>
	<m:message>
		<m:code>SEASON_HAS_REFERENCES</m:code>
		<m:severity>ERROR</m:severity>
		<m:summary>Löschen nicht erfolgreich</m:summary>
		<m:detail>Die Saison konnte nicht gelöscht werden. Es sind noch Spiele zu der Saison vorhanden</m:detail>
	</m:message>
	<m:message>
		<m:code>SEASON_SAVED</m:code>
		<m:severity>INFO</m:severity>
		<m:summary>Speichern erfolgreich</m:summary>
		<m:detail>Die Saison wurde erfolgreich gespeichert.</m:detail>
	</m:message>
	<m:message>
		<m:code>SEASON_NO_INPUT</m:code>
		<m:severity>ERROR</m:severity>
		<m:summary>Keine Eingabe!</m:summary>
		<m:detail>Es wurde keine Eingabe getätigt.</m:detail>
	</m:message>
	<m:message>
		<m:code>SEASON_SAVE_ERROR</m:code>
		<m:severity>ERROR</m:severity>
		<m:summary>Speichern nicht erfolgreich</m:summary>
		<m:detail>Die Saison konnte nicht gespeichert werden. Kollisionen prüfen</m:detail>
	</m:message>
	<m:message>
		<m:code>UNKNOWN_ERROR</m:code>
		<m:severity>ERROR</m:severity>
		<m:summary>Fehler</m:summary>
		<m:detail>Unbekannter Fehler aufgetreten</m:detail>
	</m:message>
<!--
 Messages für EditSpiel 
 -->
	<m:message>
		<m:code>GAME_DELETED</m:code>
		<m:severity>INFO</m:severity>
		<m:summary>Löschen erfolgreich</m:summary>
		<m:detail>Die Spiel wurde gelöscht</m:detail>
	</m:message>
	<m:message>
		<m:code>GAME_DELETION_ERROR</m:code>
		<m:severity>ERROR</m:severity>
		<m:summary>Löschen fehlerhaft</m:summary>
		<m:detail>Das Spiel wurde nicht gelöscht</m:detail>
	</m:message>
	<m:message>
		<m:code>NO_GAME_CHOSEN</m:code>
		<m:severity>ERROR</m:severity>
		<m:summary>Keine Auswahl!</m:summary>
		<m:detail>Es wurde keine Saison ausgewählt</m:detail>
	</m:message>
<!--
 Messages für Spiel eingeben
 -->
	<m:message>
		<m:code>GAME_SAVED</m:code>
		<m:severity>INFO</m:severity>
		<m:summary>Gespeichert</m:summary>
		<m:detail>Das Spiel wurde erfolgreich gespeichert</m:detail>
	</m:message>
	<m:message>
		<m:code>GAME_SAVE_ERROR</m:code>
		<m:severity>ERROR</m:severity>
		<m:summary>Speichern fehlerhaft</m:summary>
		<m:detail>Das Spiel konnte nicht gespeichert werden</m:detail>
	</m:message>
	<m:message>
		<m:code>GAME_PAYER_NOT_PRESENT</m:code>
		<m:severity>ERROR</m:severity>
		<m:summary>Auswahl ungültig</m:summary>
		<m:detail>Gezahlt, aber nicht anwesend</m:detail>
	</m:message>
	<m:message>
		<m:code>GAME_MORE_PAYERS</m:code>
		<m:severity>ERROR</m:severity>
		<m:summary>Auswahl ungültig</m:summary>
		<m:detail>Mehr als ein bezahlender Spieler</m:detail>
	</m:message>
	<m:message>
		<m:code>GAME_NO_PAYER</m:code>
		<m:severity>ERROR</m:severity>
		<m:summary>Auswahl ungültig</m:summary>
		<m:detail>Kein Spieler hat bezahlt</m:detail>
	</m:message>

	<m:message>
		<m:code>PLAYER_SAVED</m:code>
		<m:severity>INFO</m:severity>
		<m:summary>Gespeichert</m:summary>
		<m:detail>Der Spieler wurde erfolgreich gespeichert</m:detail>
	</m:message>

	<m:message>
		<m:code>PLAYER_EXISTING</m:code>
		<m:severity>ERROR</m:severity>
		<m:summary>Speichern fehlerhaft</m:summary>
		<m:detail>Der Spieler %s ist schon vorhanden</m:detail>
	</m:message>

	<m:message>
		<m:code>PLAYER_SAVE_ERROR</m:code>
		<m:severity>ERROR</m:severity>
		<m:summary>Speichern fehlerhaft</m:summary>
		<m:detail>Der Spieler konnte nicht gespeichert werden</m:detail>
	</m:message>

	<m:message>
		<m:code>ENTRY_SAVED</m:code>
		<m:severity>INFO</m:severity>
		<m:summary>Buchung gespeichert</m:summary>
		<m:detail>Die Buchung wurde erfolgreich gespeichert</m:detail>
	</m:message>
	<m:message>
		<m:code>ENTRY_DELETED</m:code>
		<m:severity>INFO</m:severity>
		<m:summary>Buchung gelöscht</m:summary>
		<m:detail>Die Buchung wurde erfolgreich gelöscht</m:detail>
	</m:message>
	<m:message>
		<m:code>ENTRY_DELETION_ERROR</m:code>
		<m:severity>ERROR</m:severity>
		<m:summary>Löschen fehlerhaft</m:summary>
		<m:detail>Die Buchung konnte nicht gespeichert werden</m:detail>
	</m:message>
	
	<m:message>
		<m:code>REGISTER_SUCCESSFUL</m:code>
		<m:severity>INFO</m:severity>
		<m:summary>Registrierung erfolgreich</m:summary>
		<m:detail>Die Registrierung wurde erfolgreich durchgeführt</m:detail>
	</m:message>
	<m:message>
		<m:code>ALREADYREGISTERED</m:code>
		<m:severity>ERROR</m:severity>
		<m:summary>Registrierung fehlerhaft</m:summary>
		<m:detail>Der User ist bereits registriert</m:detail>
	</m:message>
	
	<m:message>
		<m:code>ERROR</m:code>
		<m:severity>ERROR</m:severity>
		<m:summary>Registrierung fehlerhaft</m:summary>
		<m:detail>Der User ist bereits registriert</m:detail>
	</m:message>
	<m:message>
		<m:code>INFO</m:code>
		<m:severity>INFO</m:severity>
		<m:summary>Registrierung fehlerhaft</m:summary>
		<m:detail>Der User ist bereits registriert</m:detail>
	</m:message>
	<m:message>
		<m:code>FATAL</m:code>
		<m:severity>FATAL</m:severity>
		<m:summary>Registrierung fehlerhaft</m:summary>
		<m:detail>Der User ist bereits registriert</m:detail>
	</m:message>
	<m:message>
		<m:code>WARN</m:code>
		<m:severity>WARN</m:severity>
		<m:summary>Registrierung fehlerhaft</m:summary>
		<m:detail>Der User ist bereits registriert</m:detail>
	</m:message>
</m:messages>


